{
  "schema": 1,
  "id": "6a0c2b58-1d7e-4a1f-9b2a-3c4d5e6f7a8b",
  "robot_id": "arm_left",
  "task": "move_to",
  "kind": "motion",
  "status": "aborted",
  "goal_status": 6,
  "code": "collision",
  "reason": "Planned path collides with object 'mug_42'",
  "data": {
    "moveit_error_code": -12
  },
  "started_at": 1760356800970,
  "finished_at": 1760356803410,
  "session": "9f1c7a0e-4a1b-4b2c-8d1e-0f1a2b3c4d5e",
  "ts": 1760356803412
}
