{
  "schema": 1,
  "id": "51f0a2b3-c4d5-4e6f-a7b8-c9d0e1f2a3b4",
  "robot_id": "arm_left",
  "task": "reset",
  "kind": "motion",
  "status": "succeeded",
  "goal_status": 4,
  "code": "ok",
  "reason": "",
  "data": {},
  "started_at": 1760356800120,
  "finished_at": 1760356802120,
  "session": "9f1c7a0e-4a1b-4b2c-8d1e-0f1a2b3c4d5e",
  "ts": 1760356802121
}
